{
  "id": "813",
  "category_id": "113",
  "menu_id": "11",
  "name": "Grox",
  "price": "25",
  "description": "",
  "image": "ann_smith_robot_dino.jpg",
  "image2": "",
  "image3": "",
  "misc_content": "",
  "options1": "",
  "options2": "",
  "options3": "",
  "active": "1",
  "print": "1",
  "quick_item": "0",
  "last_modified_date": "0000-00-00 00:00:00",
  "printer": "0",
  "apply_taxrate": "Default",
  "custom_taxrate": "",
  "modifier_list_id": "0",
  "forced_modifier_group_id": "C",
  "ingredients": "",
  "open_item": "0",
  "hidden_value": "",
  "hidden_value2": "",
  "allow_deposit": "0",
  "UPC": "",
  "hidden_value3": "",
  "inv_count": "0",
  "show_in_app": "1",
  "super_group_id": ""
}